title,url,product_description
Masks and Shadows,https://books.toscrape.com/catalogue/masks-and-shadows_909/index.html,"The year is 1779, and Carlo Morelli, the most renowned castrato singer in Europe, has been invited as an honored guest to Eszterháza Palace. With Carlo in Prince Nikolaus Esterházy's carriage, ride a Prussian spy and one of the most notorious alchemists in the Habsburg Empire. Already at Eszterháza is Charlotte von Steinbeck, the very proper sister of Prince Nikolaus's mis The year is 1779, and Carlo Morelli, the most renowned castrato singer in Europe, has been invited as an honored guest to Eszterháza Palace. With Carlo in Prince Nikolaus Esterházy's carriage, ride a Prussian spy and one of the most notorious alchemists in the Habsburg Empire. Already at Eszterháza is Charlotte von Steinbeck, the very proper sister of Prince Nikolaus's mistress. Charlotte has retreated to the countryside to mourn her husband's death. Now, she must overcome the ingrained rules of her society in order to uncover the dangerous secrets lurking within the palace's golden walls. Music, magic, and blackmail mingle in a plot to assassinate the Habsburg Emperor and Empress--a plot that can only be stopped if Carlo and Charlotte can see through the masks worn by everyone they meet. ...more"
Princess Between Worlds (Wide-Awake Princess #5),https://books.toscrape.com/catalogue/princess-between-worlds-wide-awake-princess-5_919/index.html,"Just as Annie and Liam are busy making plans to travel the world, a witch shows up and gives them a collection of postcards from the Magic Marketplace. Each postcard gives Annie and Liam the opportunity to travel to exotic lands and far-flung kingdoms. What the witch doesn't give them are directions on how to safely return."
"Saga, Volume 6 (Saga (Collected Editions) #6)",https://books.toscrape.com/catalogue/saga-volume-6-saga-collected-editions-6_924/index.html,"After a dramatic time jump, the three-time Eisner Award winner for Best Continuing Series continues to evolve, as Hazel begins the most exciting adventure of her life: kindergarten. Meanwhile, her star-crossed family learns hard lessons of their own.Collects SAGA #31-36"
Unicorn Tracks,https://books.toscrape.com/catalogue/unicorn-tracks_951/index.html,"After a savage attack drives her from her home, sixteen-year-old Mnemba finds a place in her cousin Tumelo’s successful safari business, where she quickly excels as a guide. Surrounding herself with nature and the mystical animals inhabiting the savannah not only allows Mnemba’s tracking skills to shine, it helps her to hide from the terrible memories that haunt her.Mnemba After a savage attack drives her from her home, sixteen-year-old Mnemba finds a place in her cousin Tumelo’s successful safari business, where she quickly excels as a guide. Surrounding herself with nature and the mystical animals inhabiting the savannah not only allows Mnemba’s tracking skills to shine, it helps her to hide from the terrible memories that haunt her.Mnemba is employed to guide Mr. Harving and his daughter, Kara, through the wilderness as they study unicorns. The young women are drawn to each other, despite that fact that Kara is betrothed. During their research, they discover a conspiracy by a group of poachers to capture the Unicorns and exploit their supernatural strength to build a railway. Together, they must find a way to protect the creatures Kara adores while resisting the love they know they can never indulge. ...more"
A Storm of Swords (A Song of Ice and Fire #3),https://books.toscrape.com/catalogue/a-storm-of-swords-a-song-of-ice-and-fire-3_116/index.html,"Here is the third volume in George R.R. Martin's magnificent cycle of novels that includes A Game of Thrones and A Clash of Kings. Together, this series comprises a genuine masterpiece of modern fantasy, destined to stand as one of the great achievements of imaginative fiction.Of the five contenders for power, one is dead, another in disfavor, and still the wars rage as al Here is the third volume in George R.R. Martin's magnificent cycle of novels that includes A Game of Thrones and A Clash of Kings. Together, this series comprises a genuine masterpiece of modern fantasy, destined to stand as one of the great achievements of imaginative fiction.Of the five contenders for power, one is dead, another in disfavor, and still the wars rage as alliances are made and broken. Joffrey sits on the Iron Throne, the uneasy ruler of the Seven Kingdoms. His most bitter rival, Lord Stannis, stands defeated and disgraced, victim of the sorceress who holds him in her thrall. Young Robb still rules the North from the fortress of Riverrun. Meanwhile, making her way across a blood-drenched continent is the exiled queen, Daenerys, mistress of the only three dragons still left in the world. And as opposing forces manoeuver for the final showdown, an army of barbaric wildlings arrives from the outermost limits of civilization, accompanied by a horde of mythical Others—a supernatural army of the living dead whose animated corpses are unstoppable. As the future of the land hangs in the balance, no one will rest until the Seven Kingdoms have exploded in a veritable storm of swords... ...more"
Ash,https://books.toscrape.com/catalogue/ash_123/index.html,"Cinderella retold In the wake of her father's death, Ash is left at the mercy of her cruel stepmother. Consumed with grief, her only joy comes by the light of the dying hearth fire, rereading the fairy tales her mother once told her. In her dreams, someday the fairies will steal her away, as they are said to do. When she meets the dark and dangerous fairy Sidhean, she bel Cinderella retold In the wake of her father's death, Ash is left at the mercy of her cruel stepmother. Consumed with grief, her only joy comes by the light of the dying hearth fire, rereading the fairy tales her mother once told her. In her dreams, someday the fairies will steal her away, as they are said to do. When she meets the dark and dangerous fairy Sidhean, she believes that her wish may be granted.The day that Ash meets Kaisa, the King's Huntress, her heart begins to change. Instead of chasing fairies, Ash learns to hunt with Kaisa. Though their friendship is as delicate as a new bloom, it reawakens Ash's capacity for love-and her desire to live. But Sidhean has already claimed Ash for his own, and she must make a choice between fairy tale dreams and true love.Entrancing, empowering, and romantic, Ash is about the connection between life and love, and solitude and death, where transformation can come from even the deepest grief. ...more"
Darkfever (Fever #1),https://books.toscrape.com/catalogue/darkfever-fever-1_145/index.html,"When her sister is murdered, leaving a single clue to her death—a cryptic message on MacKayla Lane’s cell phone–Mac journeys to Ireland in search of answers. The quest to find her sister’s killer draws her into a shadowy realm where nothing is as it seems, where good and evil wear the same treacherously seductive mask. She is soon faced with an even greater challenge: stay When her sister is murdered, leaving a single clue to her death—a cryptic message on MacKayla Lane’s cell phone–Mac journeys to Ireland in search of answers. The quest to find her sister’s killer draws her into a shadowy realm where nothing is as it seems, where good and evil wear the same treacherously seductive mask. She is soon faced with an even greater challenge: staying alive long enough to learn how to handle a power she had no idea she possessed—a gift that allows her to see beyond the world of man, into the dangerous realm of the Fae. ...more"
Eragon (The Inheritance Cycle #1),https://books.toscrape.com/catalogue/eragon-the-inheritance-cycle-1_153/index.html,"One boy. One dragon. A world of adventure.When Eragon finds a polished blue stone in the forest, he thinks it is the lucky discovery of a poor farm boy; perhaps it will buy his family meat for the winter. But when the stone brings a dragon hatchling, Eragon realizes he has stumbled upon a legacy nearly as old as the Empire itself.Overnight his simple life is shattered, and One boy. One dragon. A world of adventure.When Eragon finds a polished blue stone in the forest, he thinks it is the lucky discovery of a poor farm boy; perhaps it will buy his family meat for the winter. But when the stone brings a dragon hatchling, Eragon realizes he has stumbled upon a legacy nearly as old as the Empire itself.Overnight his simple life is shattered, and he is thrust into a perilous new world of destiny, magic, and power. With only an ancient sword and the advice of an old storyteller for guidance, Eragon and the fledgling dragon must navigate the dangerous terrain and dark enemies of an Empire ruled by a king whose evil knows no bounds.Can Eragon take up the mantle of the legendary Dragon Riders? The fate of the Empire may rest in his hands. ...more"
Heir to the Sky,https://books.toscrape.com/catalogue/heir-to-the-sky_166/index.html,"As heir to a kingdom of floating continents, Kali has spent her life bound by limits—by her duties as a member of the royal family, by a forced betrothal to the son of a nobleman, and by the edge of the only world she’s ever known—a small island hovering above a monster-ridden earth, long since uninhabited by humans. She is the Eternal Flame of Hope for what’s left of mank As heir to a kingdom of floating continents, Kali has spent her life bound by limits—by her duties as a member of the royal family, by a forced betrothal to the son of a nobleman, and by the edge of the only world she’s ever known—a small island hovering above a monster-ridden earth, long since uninhabited by humans. She is the Eternal Flame of Hope for what’s left of mankind, the wick and the wax burning in service for her people, and for their revered Phoenix, whose magic keeps them aloft.When Kali falls off the edge of her kingdom and miraculously survives, she is shocked to discover there are still humans on the earth. Determined to get home, Kali entrusts a rugged monster-hunter named Griffin to guide her across a world overrun by chimera, storm dragons, basilisks, and other terrifying beasts. But the more time she spends on earth, the more dark truths she begins to uncover about her home in the sky, and the more resolute she is to start burning for herself. ...more"
Midnight Riot (Peter Grant/ Rivers of London - books #1),https://books.toscrape.com/catalogue/midnight-riot-peter-grant-rivers-of-london-books-1_194/index.html,"Probationary Constable Peter Grant dreams of being a detective in London's Metropolitan Police. Too bad his superior plans to assign him to the Case Progression Unit, where the biggest threat he'll face is a paper cut. But Peter's prospects change in the aftermath of a puzzling murder, when he gains exclusive information from an eyewitness who happens to be a ghost. Peter' Probationary Constable Peter Grant dreams of being a detective in London's Metropolitan Police. Too bad his superior plans to assign him to the Case Progression Unit, where the biggest threat he'll face is a paper cut. But Peter's prospects change in the aftermath of a puzzling murder, when he gains exclusive information from an eyewitness who happens to be a ghost. Peter's ability to speak with the lingering dead brings him to the attention of Detective Chief Inspector Thomas Nightingale, who investigates crimes involving magic and other manifestations of the uncanny. Now, as a wave of brutal and bizarre murders engulfs the city, Peter is plunged into a world where gods and goddesses mingle with mortals and long-dead evil is making a comeback on a rising tide of magic. ...more"
Soldier (Talon #3),https://books.toscrape.com/catalogue/soldier-talon-3_222/index.html,"The price of freedom is everything.When forced to choose between safety with the dragon organization Talon and being hunted forever as an outcast, Ember Hill chose to stand with Riley and his band of rogue dragons rather than become an assassin for Talon. She’s lost any contact with her twin brother, Dante, a Talon devotee, as well as Garret, the former-enemy soldier who c The price of freedom is everything.When forced to choose between safety with the dragon organization Talon and being hunted forever as an outcast, Ember Hill chose to stand with Riley and his band of rogue dragons rather than become an assassin for Talon. She’s lost any contact with her twin brother, Dante, a Talon devotee, as well as Garret, the former-enemy soldier who challenged her beliefs about her human side.As Ember and Riley hide and regroup to fight another day, Garret journeys alone to the United Kingdom, birthplace of the ancient and secret Order of St. George, to spy on his former brothers and uncover deadly and shocking secrets that will shake the foundations of dragons and dragonslayers alike and place them all in imminent danger as Talon’s new order rises. ...more"
The Rose & the Dagger (The Wrath and the Dawn #2),https://books.toscrape.com/catalogue/the-rose-the-dagger-the-wrath-and-the-dawn-2_278/index.html,"The much anticipated sequel to the breathtaking The Wrath and the Dawn, lauded by Publishers Weekly as ""a potent page-turner of intrigue and romance.""I am surrounded on all sides by a desert. A guest, in a prison of sand and sun. My family is here. And I do not know whom I can trust.In a land on the brink of war, Shahrzad has been torn from the love of her husband Khalid, The much anticipated sequel to the breathtaking The Wrath and the Dawn, lauded by Publishers Weekly as ""a potent page-turner of intrigue and romance.""I am surrounded on all sides by a desert. A guest, in a prison of sand and sun. My family is here. And I do not know whom I can trust.In a land on the brink of war, Shahrzad has been torn from the love of her husband Khalid, the Caliph of Khorasan. She once believed him a monster, but his secrets revealed a man tormented by guilt and a powerful curse—one that might keep them apart forever. Reunited with her family, who have taken refuge with enemies of Khalid, and Tariq, her childhood sweetheart, she should be happy. But Tariq now commands forces set on destroying Khalid's empire. Shahrzad is almost a prisoner caught between loyalties to people she loves. But she refuses to be a pawn and devises a plan.While her father, Jahandar, continues to play with magical forces he doesn't yet understand, Shahrzad tries to uncover powers that may lie dormant within her. With the help of a tattered old carpet and a tempestuous but sage young man, Shahrzad will attempt to break the curse and reunite with her one true love.From the Hardcover edition. ...more"
Harry Potter and the Chamber of Secrets (Harry Potter #2),https://books.toscrape.com/catalogue/harry-potter-and-the-chamber-of-secrets-harry-potter-2_325/index.html,"All Harry Potter wants is to get away from the Dursleys and go back to Hogwarts School for Witchcraft and Wizardry. But just as he's packing his bags, Harry receives a warning from a strange, impish creature named Dobby - who says that if Harry Potter returns to Hogwarts, disaster will strike.And strike it does. For in Harry's second year at Hogwarts, fresh torments and ho All Harry Potter wants is to get away from the Dursleys and go back to Hogwarts School for Witchcraft and Wizardry. But just as he's packing his bags, Harry receives a warning from a strange, impish creature named Dobby - who says that if Harry Potter returns to Hogwarts, disaster will strike.And strike it does. For in Harry's second year at Hogwarts, fresh torments and horrors arise, including an outrageously stuck-up new professor, Gilderoy Lockheart, a spirit named Moaning Myrtle who haunts the girls' bathroom, and the unwanted attentions of Ron Weasley's younger sister, Ginny.But each of these seem minor annoyances when the real trouble begins, and someone--or something--starts turning Hogwarts students to stone. Could it be Draco Malfoy, a more poisonous rival than ever? Could it possibly be Hagrid, whose mysterious past is finally told? Or could it be the one everyone at Hogwarts most suspects... Harry Potter himself. ...more"
Harry Potter and the Half-Blood Prince (Harry Potter #6),https://books.toscrape.com/catalogue/harry-potter-and-the-half-blood-prince-harry-potter-6_326/index.html,"It is the middle of the summer, but there is an unseasonal mist pressing against the windowpanes. Harry Potter is waiting nervously in his bedroom at the Dursleys' house in Privet Drive for a visit from Professor Dumbledore himself. One of the last times he saw the Headmaster was in a fierce one-to-one duel with Lord Voldemort, and Harry can't quite believe that Professor It is the middle of the summer, but there is an unseasonal mist pressing against the windowpanes. Harry Potter is waiting nervously in his bedroom at the Dursleys' house in Privet Drive for a visit from Professor Dumbledore himself. One of the last times he saw the Headmaster was in a fierce one-to-one duel with Lord Voldemort, and Harry can't quite believe that Professor Dumbledore will actually appear at the Dursleys' of all places. Why is the Professor coming to visit him now? What is it that cannot wait until Harry returns to Hogwarts in a few weeks' time? Harry's sixth year at Hogwarts has already got off to an unusual start, as the worlds of Muggle and magic start to intertwine...J.K. Rowling charts Harry Potter's latest adventures in his sixth year at Hogwarts with consummate skill and in breathtaking fashion. ...more"
Harry Potter and the Order of the Phoenix (Harry Potter #5),https://books.toscrape.com/catalogue/harry-potter-and-the-order-of-the-phoenix-harry-potter-5_327/index.html,"Harry Potter is due to start his fifth year at Hogwarts School of Witchcraft and Wizardry. His best friends Ron and Hermione have been very secretive all summer and he is desperate to get back to school and find out what has been going on. However, what Harry discovers is far more devastating than he could ever have expected...Suspense, secrets and thrilling action from th Harry Potter is due to start his fifth year at Hogwarts School of Witchcraft and Wizardry. His best friends Ron and Hermione have been very secretive all summer and he is desperate to get back to school and find out what has been going on. However, what Harry discovers is far more devastating than he could ever have expected...Suspense, secrets and thrilling action from the pen of J.K. Rowling ensure an electrifying adventure that is impossible to put down. ...more"
Paper and Fire (The Great Library #2),https://books.toscrape.com/catalogue/paper-and-fire-the-great-library-2_339/index.html,"In Ink and Bone, New York Times bestselling author Rachel Caine introduced a world where knowledge is power, and power corrupts absolutely. Now, she continues the story of those who dare to defy the Great Library—and rewrite history…With an iron fist, The Great Library controls the knowledge of the world, ruthlessly stamping out all rebellion, forbidding the personal owner In Ink and Bone, New York Times bestselling author Rachel Caine introduced a world where knowledge is power, and power corrupts absolutely. Now, she continues the story of those who dare to defy the Great Library—and rewrite history…With an iron fist, The Great Library controls the knowledge of the world, ruthlessly stamping out all rebellion, forbidding the personal ownership of books in the name of the greater good.Jess Brightwell has survived his introduction to the sinister, seductive world of the Library, but serving in its army is nothing like he envisioned. His life and the lives of those he cares for have been altered forever. His best friend is lost, and Morgan, the girl he loves, is locked away in the Iron Tower and doomed to a life apart.Embarking on a mission to save one of their own, Jess and his band of allies make one wrong move and suddenly find themselves hunted by the Library’s deadly automata and forced to flee Alexandria, all the way to London.But Jess’s home isn’t safe anymore. The Welsh army is coming, London is burning, and soon, Jess must choose between his friends, his family, or the Library willing to sacrifice anything and anyone in the search for ultimate control… ...more"
The Beast (Black Dagger Brotherhood #14),https://books.toscrape.com/catalogue/the-beast-black-dagger-brotherhood-14_342/index.html,"Rhage and Mary return in a new novel of the Black Dagger Brotherhood, a series “so popular, I don’t think there’s a reader today who hasn’t at least heard of [it]” (USA Today).Nothing is as it used to be for the Black Dagger Brotherhood. After avoiding war with the Shadows, alliances have shifted and lines have been drawn. The slayers of the Lessening Society are stronger Rhage and Mary return in a new novel of the Black Dagger Brotherhood, a series “so popular, I don’t think there’s a reader today who hasn’t at least heard of [it]” (USA Today).Nothing is as it used to be for the Black Dagger Brotherhood. After avoiding war with the Shadows, alliances have shifted and lines have been drawn. The slayers of the Lessening Society are stronger than ever, preying on human weakness to acquire more money, more weapons, more power. But as the Brotherhood readies for an all-out attack on them, one of their own fights a battle within himself…For Rhage, the Brother with the biggest appetites, but also the biggest heart, life was supposed to be perfect—or at the very least, perfectly enjoyable. Mary, his beloved shellan, is by his side and his King and his brothers are thriving. But Rhage can’t understand—or control—the panic and insecurity that plague him…And that terrifies him—as well as distances him from his mate. After suffering mortal injury in battle, Rhage must reassess his priorities—and the answer, when it comes to him, rocks his world...and Mary’s. But Mary is on a journey of her own, one that will either bring them closer together or cause a split that neither will recover from... ...more"
The Demonists (Demonist #1),https://books.toscrape.com/catalogue/the-demonists-demonist-1_345/index.html,"There is more to our world than meets the eye—darker things, crueler things. Exorcist John Fogg and his wife, psychic medium Theodora Knight, know what lurks in the shadows. But even they’re not prepared for the worst Hell has to offer... It was supposed to be a simple exorcism, a publicity stunt to firmly establish John and Theodora’s thriving paranormal investigation em There is more to our world than meets the eye—darker things, crueler things. Exorcist John Fogg and his wife, psychic medium Theodora Knight, know what lurks in the shadows. But even they’re not prepared for the worst Hell has to offer...   It was supposed to be a simple exorcism, a publicity stunt to firmly establish John and Theodora’s thriving paranormal investigation empire in the public eye. But something went wrong, leading to an on-air massacre that unleashed a malicious host of demons and left Theodora catatonic, possessed by countless spirits.   John sets out on a desperate quest to find a cure for his wife, but his obsession brings him face-to-face with an even more terrifying problem: Theodora’s possession is only one piece of a deadly plot that is threatening the entire world. Because an ancient evil is about to make Earth its battlefield—and without John and Theodora’s intervention, there is no chance for salvation... ...more"
A Feast for Crows (A Song of Ice and Fire #4),https://books.toscrape.com/catalogue/a-feast-for-crows-a-song-of-ice-and-fire-4_357/index.html,"With A Feast for Crows, Martin delivers the long-awaited fourth volume of the landmark series that has redefined imaginative fiction and stands as a modern masterpiece in the making.After centuries of bitter strife, the seven powers dividing the land have beaten one another into an uneasy truce. But it's not long before the survivors, outlaws, renegades, and carrion eaters With A Feast for Crows, Martin delivers the long-awaited fourth volume of the landmark series that has redefined imaginative fiction and stands as a modern masterpiece in the making.After centuries of bitter strife, the seven powers dividing the land have beaten one another into an uneasy truce. But it's not long before the survivors, outlaws, renegades, and carrion eaters of the Seven Kingdoms gather. Now, as the human crows assemble over a banquet of ashes, daring new plots and dangerous new alliances are formed while surprising faces—some familiar, others only just appearing—emerge from an ominous twilight of past struggles and chaos to take up the challenges of the terrible times ahead. Nobles and commoners, soldiers and sorcerers, assassins and sages, are coming together to stake their fortunes...and their lives. For at a feast for crows, many are the guests—but only a few are the survivors. ...more"
